<?xml version="1.0" encoding="UTF-8"?>
<xsd:schema xmlns:xsd="http://www.w3.org/2001/XMLSchema">


	<!-- Création de type personnalisé -->
	
	<!-- Type d'event -->
	<!--<xsd:simpleType name="primitive_event_type_type">
    	<xsd:restriction base="xsd:string">
			<xsd:enumeration value="PEG_Blank"/>
			<xsd:enumeration value="PEG_Co_ResponseTime"/>
			<xsd:enumeration value="PEG_Pm_Cpu"/>
			<xsd:enumeration value="PEG_Pm_Disk"/>
			<xsd:enumeration value="PEG_Pm_Ram"/>
			<xsd:enumeration value="PEG_Vm_Cpu"/>
			<xsd:enumeration value="PEG_Vm_Disk"/>
			<xsd:enumeration value="PEG_Vm_Ram"/>
    	</xsd:restriction>
	</xsd:simpleType>

	<xsd:simpleType name="simple_event_type_type">
		<xsd:restriction base="xsd:string">
			<xsd:enumeration value="SEG_Cpu_Drop"/>
            <xsd:enumeration value="SEG_Cpu_Overload"/>
			<xsd:enumeration value="SEG_Ram_Drop"/>
		</xsd:restriction>
	</xsd:simpleType>

	<xsd:simpleType name="complex_event_type_type">
		<xsd:restriction base="xsd:string">
			<xsd:enumeration value="CEG_Cpu_Dead"/>
		</xsd:restriction>
	</xsd:simpleType>-->

	<xsd:simpleType name="primitive_event_type_type">
		<xsd:restriction base="xsd:string"/>
	</xsd:simpleType>

	<xsd:simpleType name="simple_event_type_type">
		<xsd:restriction base="xsd:string"/>
	</xsd:simpleType>

	<xsd:simpleType name="complex_event_type_type">
		<xsd:restriction base="xsd:string"/>
	</xsd:simpleType>

	<!-- Temps d'intervalle entre deux exécutions -->
	<xsd:simpleType name="event_name_runtime">
		<xsd:restriction base="xsd:integer">
			<xsd:minInclusive value="0"/>
		</xsd:restriction>
	</xsd:simpleType>

	<xsd:simpleType name="event_name_type">
		<xsd:restriction base="xsd:string"/>
	</xsd:simpleType>

	<xsd:simpleType name="event_activated">
		<xsd:restriction base="xsd:boolean"/>
	</xsd:simpleType>
	
	
	<!-- Schéma XML -->

		<!-- Primitive events -->
	<xsd:element name="primitive">
		<xsd:complexType>
			<xsd:sequence>
				<xsd:element name="name" type="event_name_type" minOccurs="1" maxOccurs="1"/>
				<xsd:element name="type" type="primitive_event_type_type" minOccurs="1" maxOccurs="1"/>
				<xsd:element name="runtime" type="event_name_runtime" minOccurs="1" maxOccurs="1"/>
			</xsd:sequence>
            <xsd:attribute name="enabled" use="required" type="event_activated"/>
		</xsd:complexType>
	</xsd:element>

	<xsd:element name="primitives">
		<xsd:complexType>
			<xsd:sequence>
				<xsd:element ref="primitive" minOccurs="1" maxOccurs="unbounded"/>
			</xsd:sequence>
		</xsd:complexType>
	</xsd:element>

		<!-- Simple and complex events -->
	<xsd:element name="param">
		<xsd:complexType>
			<xsd:simpleContent>
				<xsd:extension base="xsd:string">
					<xsd:attribute name="tag" use="required" type="xsd:string"/>
					<xsd:attribute name="type" use="required" type="xsd:string"/>
				</xsd:extension>
			</xsd:simpleContent>
		</xsd:complexType>
	</xsd:element>

	<xsd:element name="params">
		<xsd:complexType>
			<xsd:sequence>
				<xsd:element ref="param" minOccurs="1" maxOccurs="unbounded"/>
			</xsd:sequence>
		</xsd:complexType>
	</xsd:element>

		<!-- Simple events -->
	<xsd:element name="simple">
		<xsd:complexType>
			<xsd:sequence>
				<xsd:element name="name" type="event_name_type" minOccurs="1" maxOccurs="1"/>
				<xsd:element name="type" type="simple_event_type_type" minOccurs="1" maxOccurs="1"/>
				<xsd:element ref="params" minOccurs="1" maxOccurs="1"/>
			</xsd:sequence>
			<xsd:attribute name="enabled" use="required" type="event_activated"/>
		</xsd:complexType>
	</xsd:element>

	<xsd:element name="simples">
		<xsd:complexType>
			<xsd:sequence>
				<xsd:element ref="simple" minOccurs="1" maxOccurs="unbounded"/>
			</xsd:sequence>
		</xsd:complexType>
	</xsd:element>

		<!-- Complex events -->
	<xsd:element name="complexe">
		<xsd:complexType>
			<xsd:sequence>
				<xsd:element name="name" type="event_name_type" minOccurs="1" maxOccurs="1"/>
				<xsd:element name="type" type="complex_event_type_type" minOccurs="1" maxOccurs="1"/>
				<xsd:element ref="params" minOccurs="1" maxOccurs="1"/>
			</xsd:sequence>
			<xsd:attribute name="enabled" use="required" type="event_activated"/>
		</xsd:complexType>
	</xsd:element>

	<xsd:element name="complexes">
		<xsd:complexType>
			<xsd:sequence>
				<xsd:element ref="complexe" minOccurs="1" maxOccurs="unbounded"/>
			</xsd:sequence>
		</xsd:complexType>
	</xsd:element>

	<!-- Events -->
	<xsd:element name="events">
		<xsd:complexType>
			<xsd:sequence>
				<xsd:element ref="primitives"  minOccurs="1" maxOccurs="1"/>
				<xsd:element ref="simples"  minOccurs="1" maxOccurs="1"/>
				<xsd:element ref="complexes"  minOccurs="1" maxOccurs="1"/>
			</xsd:sequence>
		</xsd:complexType>
	</xsd:element>
	
	<xsd:element name="perception">
		<xsd:complexType>
			<xsd:sequence>
				<xsd:element ref="events" minOccurs="1" maxOccurs="1"/>
			</xsd:sequence>
		</xsd:complexType>
	</xsd:element>

</xsd:schema>