<?xml version="1.0" encoding="UTF-8"?>
<perception
        xs:noNamespaceSchemaLocation="../../../../../../resources/schema.xsd"
        xmlns:xs="http://www.w3.org/2001/XMLSchema-instance"
>
    <events>
        <primitives>
            <primitive enabled="true">
                <name>PEG_Pm_Cpu1</name>
                <type>PEG_Pm_Cpu</type>
                <runtime>12000</runtime>
            </primitive>
            <primitive enabled="false">
                <name>PEG_Pm_Disk1</name>
                <type>PEG_Pm_Disk</type>
                <runtime>89100</runtime>
            </primitive>
        </primitives>
        <simples>
            <simple enabled="false">
                <name>SEG_Cpu_Drop1</name>
                <type>SEG_Cpu_Drop</type>
                <params>
                    <param tag="runtime" type="Integer">12</param>
                </params>
            </simple>
        </simples>
        <complexes>
            <complex enabled="false">
                <name>CEG_Dead_Cpu1</name>
                <type>CEG_Dead_Cpu</type>
                <params>
                    <param tag="runtime" type="Integer">12</param>
                </params>
            </complex>
        </complexes>
    </events>
</perception>