<?xml version="1.0" encoding="UTF-8"?>
<perception
        xs:noNamespaceSchemaLocation="../../../../../../resources/schema.xsd"
        xmlns:xs="http://www.w3.org/2001/XMLSchema-instance"
>
    <events>
        <primitives>
            <primitive enabled="true">
                <name>hey</name>
                <type>PEG_Co_ResponseTime</type>
            </primitive>
            <primitive enabled="true">
                <name>event2</name>
                <type>PEG_Vm_Cpu</type>
                <runtime>11000</runtime>
            </primitive>
            <primitive enabled="false">
                <name>event3</name>
                <type>PEG_Pm_Cpu</type>
                <runtime>98000</runtime>
            </primitive>
        </primitives>
    </events>
</perception>