<?xml version="1.0" encoding="UTF-8"?>
<perception
        xs:noNamespaceSchemaLocation="../../../../../resources/schema.xsd"
        xmlns:xs="http://www.w3.org/2001/XMLSchema-instance"
>
    <events>
        <primitives>
            <primitive>
                <name>PEG_Vm_Disk</name>
                <runtime>700</runtime>
            </primitive>
            <primitive enabled="true">
                <name>PEG_Vm_Cpu</name>
                <runtime>1100</runtime>
            </primitive>
        </primitives>
    </events>
</perception>