<?xml version="1.0" encoding="UTF-8"?>
<perception
        xs:noNamespaceSchemaLocation="../../../../../resources/schema.xsd"
        xmlns:xs="http://www.w3.org/2001/XMLSchema-instance"
>
    <events>
        <primitives>
            <primitive enabled="true">
                <name>MonPEGCoResponseTime</name>
                <type>PEG_Co_ResponseTime</type>
                <runtime>78000</runtime>
            </primitive>
            <primitive enabled="true">
                <name>MonPEGVmCpu</name>
                <type>PEG_Vm_Cpu</type>
                <runtime>1000</runtime>
            </primitive>
            <primitive enabled="false">
                <name>MonPEGBlank</name>
                <type>PEG_Blank</type>
                <runtime>81000</runtime>
            </primitive>
            <primitive enabled="true">
                <name>MonPEGPmCpu</name>
                <type>PEG_Pm_Cpu</type>
                <runtime>9000</runtime>
            </primitive>
        </primitives>
    </events>
</perception>