<?xml version="1.0" encoding="UTF-8"?>
<perception
        xs:noNamespaceSchemaLocation="../../../../../../resources/schema.xsd"
        xmlns:xs="http://www.w3.org/2001/XMLSchema-instance"
>
    <events>
        <primitives>
            <primitive enabled="true">
                <name>MonPEGCoResponseTime</name>
                <type>PEG_Co_ResponseTime</type>
                <runtime>78000</runtime>
            </primitive>
            <primitive enabled="true">
                <name>MonPEGPmCPU</name>
                <type>PEG_Vm_Cpu</type>
                <runtime>11000</runtime>
            </primitive>
            <primitive enabled="true">
                <name>MonPEGVmCPU</name>
                <type>PEG_Pm_Cpu</type>
                <runtime>98000</runtime>
            </primitive>
        </primitives>
        <simples>
            <simple enabled="true">
                <name>MonSimpleEvent2</name>
                <type>SEG_Cpu_Drop</type>
                <params>
                    <param tag="ip4" type="Long">1245</param>
                </params>
            </simple>
        </simples>
    </events>
</perception>